{
  "score": 82,
  "tier": "HOT",
  "intent": "automatización de leads",
  "pain_point": "seguimiento manual y pérdida de oportunidades",
  "reason": "El lead pide automatización y tiene urgencia temporal.",
  "recommended_action": "Notificar a operador y proponer llamada de diagnóstico.",
  "suggested_reply": "Gracias, podemos ayudarte a automatizar captación y seguimiento. Te paso con un especialista para revisar tu caso."
}
